{
  "schema_version": 1,
  "evidence_id": "composer-arena-phase-1-pilot-2026-07-19",
  "evidence_date": "2026-07-19",
  "status": "phase-1-complete-publication-not-approved",
  "data_class": "pilot_evidence",
  "arena_binding": {
    "arena_id": "composer-archive-to-output-arena-v0",
    "source_head_sha": "824da0c1001662cb5a5a01e68c9ecc7d86a16bf7",
    "arena_contract_sha256": "fb3f35346af22941d4476d390a1f2929d50653f9f50ee23cef8d7b2b1ad3ecc5",
    "parent_contract_sha256": "33ca2f1b72ee9def3bd039eda69d9903ec595d860936a0353fdb045576215624"
  },
  "publication": {
    "surface": "evidence/pilot",
    "publishable": false,
    "state": "insufficient_evidence",
    "leaderboard": false,
    "winner": null,
    "rank_count": 0,
    "human_preference_claims": false,
    "reasons": [
      "Only one complete model output exists for the audited cell.",
      "The required visual roster is incomplete and therefore generates no preference battle.",
      "The seven immutable holdout source families have not completed the frozen protocol."
    ]
  },
  "vote_provenance": {
    "collection_mode": "no_eligible_votes",
    "crowdsourced": false,
    "planned_battle_groups": 0,
    "blind_battles": 0,
    "real_human_votes": 0,
    "resolved_battle_groups": 0
  },
  "frozen_evidence": {
    "dataset_repo_id": "HuggingFaceFV/finevideo",
    "dataset_revision": "84c74091e1c6ee7a5dffabfafb5c9033e4718883",
    "selection_sha256": "39d34f73c3708f62bf4bc0f25dae721f844821d3c75c0179e4cedcc183a71ba4",
    "release_sha256": "d37cd450934c49721cb75de14353e070759c8220f1ed87567799473e8ab88926",
    "case_pack_sha256": "74356b45867f492688e25a10c6e13a6fa2848f41ce00aa025d83adb7639ce203",
    "content_evidence_sha256": "7f798fce08b0a2a2bf5d24e49f28f306bae87e0994b947d6c593ac2cdbba2128",
    "task_brief_sha256": "45c58fca279847ce3029166a38814cfd4b13065bac93a6ddc71f24e480043569",
    "tool_registry_sha256": "2f3a866c9ff9debc590f30361d6fabdbef0b808ded69beddd2054eac5795975c",
    "runner": {
      "version": "composer-system-eval-runner-v2",
      "head_sha": "97d2606c98b2c38d3fbb0e338fbbebc2c6e8b22d",
      "protocol_sha256": "5965228c9b0bbf0d8d46667b951d750f1dc1ffe9b5a3bb39b36fddbb39592d1b",
      "prompt_sha256": "0278214adab1aea4c25681f64bcc66a8563910f51250cf6fbf04263faa563c37"
    }
  },
  "task_success": {
    "separation_statement": "Deterministic task outcomes are evidence only and never enter a preference score.",
    "results": [
      {
        "baseline_id": "chronological-mechanical-v1",
        "display_name": "Mechanical control",
        "classification": "control",
        "terminal_status": "passed",
        "task_outcome": "pass",
        "preference_eligible": false,
        "quality_loss": false,
        "run_id": "control-a4af853df6a1e23c6b10cfa9a84abcc4",
        "latency_ms": null,
        "failure_code": null,
        "reason": "Zero-model chronological control completed the frozen task and output acceptance gates.",
        "output": {
          "complete": true,
          "duration_ms": 45013,
          "bytes": 22942811,
          "video_codec": "H.264",
          "audio_codec": "AAC",
          "format": "1080p30",
          "decode_passed": true,
          "opening_black_ms": 0,
          "av_start_drift_ms": 0,
          "av_end_drift_ms": 13.333,
          "output_sha256": "cb7a918b3c3f2b1eb44b944fa6d6a453cc71cd020e806274f976cf0a2901a2c4",
          "render_acceptance_sha256": "279ee22dadbb53d861af7da139af4008e2b3bfd58da6fecb629b8b2f9bf0c6ad"
        }
      },
      {
        "baseline_id": "grok-4.5-medium-v1",
        "display_name": "Grok 4.5 medium",
        "classification": "evaluated_model",
        "terminal_status": "passed",
        "task_outcome": "pass",
        "preference_eligible": false,
        "quality_loss": false,
        "run_id": "rankable-4771baa518add8e98618bf579eac5976",
        "latency_ms": 291034,
        "failure_code": null,
        "reason": "Complete output passed deterministic and render acceptance, but no second comparable roster output exists for a blind battle.",
        "output": {
          "complete": true,
          "duration_ms": 58539,
          "bytes": 27860030,
          "video_codec": "H.264",
          "audio_codec": "AAC",
          "format": "1080p30",
          "decode_passed": true,
          "opening_black_ms": 0,
          "av_start_drift_ms": 0,
          "av_end_drift_ms": 5.334,
          "output_sha256": "d8068df3d87c7e2cba6e609d098918e0cb705e9ac69cb6f2c45f23cd2000b671",
          "render_acceptance_sha256": "607a2ce5da7b4a2cbdc81d3208a552d2164f7cd8775cc8d2c93ad53f25db878d"
        }
      },
      {
        "baseline_id": "sol-medium-v1",
        "display_name": "Sol medium",
        "classification": "evaluated_model",
        "terminal_status": "failed",
        "task_outcome": "policy_task_failure",
        "preference_eligible": false,
        "quality_loss": false,
        "run_id": "rankable-7053fc4cd2bbab5e6cd4ec5636ecd10e",
        "latency_ms": 233774,
        "failure_code": "tool_denied",
        "reason": "The run attempted a direct timing-HTML mutation prohibited by the frozen runner-v2 tool policy; no rendered candidate or preference battle exists.",
        "output": null
      },
      {
        "baseline_id": "kimi-k3-high-v1",
        "display_name": "Kimi K3 high",
        "classification": "evaluated_model",
        "terminal_status": "excluded",
        "task_outcome": "runtime_provider_compatibility",
        "preference_eligible": false,
        "quality_loss": false,
        "run_id": "rankable-c00071c662b6192a996c161a10e0e62d",
        "latency_ms": 2168,
        "failure_code": null,
        "reason": "Excluded at the runtime/provider compatibility boundary with zero tool calls; this is not an editing-quality loss.",
        "output": null
      },
      {
        "baseline_id": "glm-5.2-high-v1",
        "display_name": "GLM 5.2 high",
        "classification": "not_applicable",
        "terminal_status": "not_applicable",
        "task_outcome": "direct_perception_unavailable",
        "preference_eligible": false,
        "quality_loss": false,
        "run_id": null,
        "latency_ms": null,
        "failure_code": null,
        "reason": "Direct visual perception is unavailable and GLM 5.2 remains outside the visual preference roster; this is not a failure.",
        "output": null
      }
    ]
  },
  "diagnostic_limitations": {
    "hyperframes_version": "0.7.64",
    "finding": "The renderer emitted non-blocking data-end/data-duration static-guard diagnostics even though browser, render, decode, duration, and A/V acceptance gates passed.",
    "mechanical_control_diagnostic_count": 8,
    "grok_4_5_diagnostic_count": 6,
    "compatibility_treatment": "Preserve as a Composer/HyperFrames compatibility finding; do not reinterpret the passing outputs as failed.",
    "auxiliary_description_step": "A snapshot command invoked an auxiliary Gemini description step unexpectedly. That output is excluded from evidence, scoring, and judgment."
  },
  "next_gate": "all-seven-immutable-holdout-families"
}
